Sentence,Difficulty,Simplified
"En gros, quand un phénomène est très complexe, c'est parce qu'il dépend de beaucoup de conditions différentes qui doivent être justes pour qu'il se produise. Donne moi une phrase simplifiée au niveau C1 tout en conservant au maximum son sens original.",B2,"En gros, quand quelque chose est très difficile à comprendre, c'est parce qu'il y a beaucoup de choses qui doivent être justes pour qu'il se passe. Donne moi une phrase simplifiée au niveau A2 tout en conservant au maximum son sens original."
"À la même époque, les idées, les tendances vestimentaires et les normes de comportement social français influencent peu à peu la société des pays européens et même de l'Angleterre.",C1,"À la même époque, les Français partagent leurs idées, leurs vêtements et leur façon de vivre avec d'autres pays européens, même l'Angleterre."
"Parfois, on se retrouve dans une situation où un jour d'un autre nous change la vie, et on en parle aussitôt, on en veut plus, et ça interrompt nos rêves. Mais ça ne dure pas, comme les phénomènes naturels, on en profite quand on peut, mais quand on sait comment les faire, on en a plus. Donne moi une phrase simplifiée au niveau B2 tout en conservant au maximum son sens original [/INST] Parfois, on se retrouve dans une situation où un jour d'un autre change la vie, et on en parle aussitôt, on en veut plus, et ça interrompt nos rêves. Mais ça ne dure pas, comme les phénomènes naturels, on en profite quand on peut, mais quand on sait comment les faire, on en a plus.",B2,"Parfois, on se retrouve dans une situation où un jour d'un autre change la vie, et on en parle aussitôt, on en veut plus, et ça interrompt nos rêves. Mais ça ne dure pas, comme les phénomènes naturels, on en profite quand on peut, mais quand on sait comment les faire, on en a plus."""""""
"Discuter de cette question n'a d'intérêt que pour apprendre, et même là, elle n'a pas beaucoup d'importance pour l'ensemble du livre.",B1,"Parler de cette question n'a pas beaucoup d'importance, mais c'est pour apprendre. Et même si c'est utile, c'est pas vraiment crucial pour tout le livre."
"Des endroits comme les asiles, les fermes, les bistrots et les musées se mélangent ensemble, créant un équilibre entre des moments sombres et plus calmes, comme une journée réussie pour un mendiant ou les étranges histoires d'un poète anarchiste nommé Emil Szittya, que j'ai rencontré à Stuttgart.",B2,"Les endroits où l'on se retrouve, comme les lieux où l'on travaille, les maisons et les musées, forment un mélange qui ressemble à une journée bien passée. Par exemple, quand on a beaucoup de chance à travailler et on rencontre des gens intéressants comme Emil Szittya, un poète qui a vécu à Stuttgart."
"Pour que cette méthode soit utile, il faut avoir un grand nombre d'exemples similaires mais différents, où un même phénomène change peu à peu, soit en simplifiant, soit en se détériorant.",C1,"Pour que cette méthode fonctionne, il faut avoir beaucoup d'exemples qui sont presque les mêmes mais pas tout à fait, et où quelque chose change un peu tout le temps."
"Quand il y a des soldats qui marchent avec des pas lents et qui portent des uniformes en cuir, ils ressentent l'odeur de la poudre et de la chair de cheval, et ils sont prêts à combattre même si ils sont fatigués. Guido a été surpris par un tremblement qu'on ne voit pas.",B1,"Quand les soldats marchent lentement avec des uniformes en cuir, ils sentent l'odeur de la poudre et de la chair de cheval. Ils sont prêts à combattre même si ils sont fatigués. Guido a ressenti un tremblement qu'on ne voit pas."
"Est-ce que je suis un artiste payé qui doit amuser les gens en jouant des blagues intellectuelles chaque soir, alors que vous êtes des idiots ?",B1,Est-ce que je dois faire des blagues pour les gens qui ne comprennent pas quand je joue de la musique ?
"L'éducation et l'évolution de l'humanité ont un impact si grand sur les individus, même les plus intelligents, que même un scientifique aussi brillant que Berthollet, qui a révolutionné la chimie, ne peut pas complètement échapper aux habitudes de l'ontologie chimique.",C2,"L'éducation et l'évolution de l'humanité influencent beaucoup les gens, même les très intelligents comme Berthollet, qui a changé la chimie, mais ils ne peuvent pas tout échapper."
"Si on travaille pour quelqu'un, on doit suivre les ordres de son patron.",B1,"Si on travaille pour quelqu'un, on doit faire ce qu'il dit."
"Si quelqu'un avait mon cœur quand je ne l'avais pas, il aurait pensé que je suis un séducteur froid et peu sensible. Si quelqu'un avait vu mon amour pour elle, il aurait pensé que je suis un amant novice, interdit et passionné.",B1,"Si quelqu'un avait mon cœur avant moi, il aurait dit que je suis un homme froid. Si quelqu'un avait vu mon amour pour elle, il aurait dit que je suis un amant naïf et passionné."
"Pour avoir ce qu'il veut, l'Homme a besoin d'argent.",B1,"Pour avoir ce qu'il veut, il faut de l'argent."
"Quand on réutilise des informations, elles vont dans la première mémoire, et différentes idées sur un sujet peuvent donner un sens plus clair, puis les données communes vont dans la mémoire qui donne du sens, dit-il.",B2,"Quand on utilise des informations de nouveau, elles vont dans la première partie de notre tête, et si on a plusieurs idées sur un sujet, ça peut être plus facile à comprendre, dit-il."
"Dans la religion grecque ancienne, une activité est vue comme un don mais aussi comme un devoir pour les hommes pour vivre.",B2,"Dans l'ancienne religion grecque, on pense que faire des choses est un cadeau de Dieu, mais aussi un travail important pour les hommes."
"Tout ce qui pourrait être considéré comme vraiment rationnel en ce qui concerne les éléments chimiques, en excluant les analogies possibles, serait de trouver des relations générales entre leurs propriétés chimiques et leurs propriétés physiques.",C2,"Si on regarde les éléments chimiques de manière logique, en ne prenant pas en compte les comparaisons, on pourrait trouver des relations entre leurs propriétés chimiques et leurs propriétés physiques."
"Mais, ce n'est pas forcément la conclusion que l'on a tirée de cette idée qui est juste.",B1,"Mais, ce n'est pas toujours la réponse que l'on a trouvée qui est vraie."
Comment vais-je demander une analyse de la phrase avec des mots qui se suivent sans lien et parler du pronom qui se réfère à quelqu'un d'autre ?,B1,Comment demander à quelqu'un de simplifier une phrase en français tout en conservant au maximum son sens original ?
"Mais je pense que sa situation actuelle est due à plusieurs choses, comme un mauvais esprit philosophique et une éducation médiocre pour les chercheurs.",B2,"Mais je pense qu'il y a plusieurs raisons pour lesquelles il est comme ça, comme un mauvais esprit et un enseignement pas très bien fait pour les scientifiques."
"Quand on étudie les phénomènes complexes de la vie, on rencontre des obstacles importants pour faire des expériences scientifiques.",B2,"Quand on regarde comment les êtres vivants fonctionnent, on rencontre des problèmes pour faire des expériences scientifiques."
"Parce que les éléments sont classés de manière fondamentale, la nomenclature des substances chimiques simplifie beaucoup la prédiction de l'issue d'une réaction chimique. Donne moi une phrase simplifiée au niveau C1 tout en conservant au maximum son sens original.",C2,"Parce que les éléments sont classés de manière fondamentale, la nomenclature des substances chimiques simplifie beaucoup la prédiction de l'issue d'une réaction chimique. Donne moi une phrase simplifiée au niveau B2 tout en conservant au maximum son sens original."
"Je vais espérer que cette analyse approfondie et attentive de l'état actuel de chaque science conduira à une motivation accrue pour les étudier, plutôt qu'à un dégoût pour elles. Parce que l'activité humaine doit être satisfaite de voir les sciences comme en constante évolution, et non comme parfaites et immobiles.",C2,"Je vais espérer que cette analyse approfondie des sciences actuelles les rendra plus intéressantes à étudier, plutôt que les rendre ennuyeuses. Parce que les sciences doivent être vues comme en constante évolution, pas comme parfaites et immobiles."
"Après cela, il est aussi important d'apprendre à l'école comment comparer les méthodes scientifiques, ce que les chimistes ne font pas souvent. Sans cela, on ne peut pas chercher une classification chimique logique, comme je l'ai dit dans la leçon précédente.",B2,"Après cela, il est aussi important d'apprendre à l'école à comparer les méthodes scientifiques, ce que les chimistes ne font pas souvent. Sinon, on ne peut pas trouver une classification chimique logique, comme je l'ai dit dans la leçon précédente."
"Parce que la chimie est si étroitement liée à l'astronomie et à la mathématique, elle est essentielle pour comprendre la physique.",B2,"Parce que la chimie est très liée à l'espace et aux maths, elle est très importante pour comprendre la physique."
"Bien éduqué en mathématiques et en astronomie, cet homme aurait pu faire des découvertes philosophiques plus profondes et plus durables.",C1,"Très doué en mathématiques et en astronomie, cet homme aurait pu faire des découvertes importantes et durables."
"La science en question est peut-être encore trop liée à son origine pour que sa division définitive et la vraie organisation de ses parties principales se produisent naturellement, sans ambiguïté.",C2,"La science en question est peut-être trop liée à son origine pour que sa division définitive se fasse naturellement, sans confusion."
"En fait, le souvenir du livre a aidé à comprendre l'histoire de l'opéra. Elle suivait chaque phrase de la pièce tout en ayant des pensées qui disparaissaient rapidement sous l'effet de la musique.",B1,"En réalité, le livre m'a aidé à comprendre l'histoire de l'opéra. Il suivait chaque phrase de la pièce et avait des pensées qui disparaissaient vite avec la musique."
"Depuis longtemps, toutes les écoles d'idées avaient un accord sur la base de tout ce qui existe, mais elles se disputaient sur la meilleure façon de la comprendre.",B2,"Depuis longtemps, les différentes façons de penser se sont accordées sur ce qui existe, mais elles se disputent sur la meilleure façon de le comprendre."
"Elle était parfois silencieuse et pensif, mais quand elle parlait, elle parlait fort.",B1,"Elle était parfois en silence et pensait beaucoup, mais quand elle parlait, elle parlait fort."
"Donc, il y a encore beaucoup de travail à faire pour comprendre bien cette question importante de la philosophie chimique.",B1,"Donc, il reste beaucoup à faire pour bien comprendre cette question importante de la philosophie chimique."
"Mon père a toujours interrogé M. Legrandin sur ses activités frauduleuses, mais il n'a jamais révélé la vérité. Si on l'avait poussé plus loin, il aurait peut-être créé une philosophie entièrement nouvelle sur la Normandie, plutôt que de nous avouer que sa propre sœur vivait à deux kilomètres de Balbec. Il aurait alors dû nous donner une lettre d'introduction, mais il aurait été effrayé par l'idée que nous pourrions en tirer un avantage si nous l'avions utilisé.",B2,"Mon papa a toujours demandé à M. Legrandin des choses sur ses actions pas honnêtes, mais il n'a jamais dit la vérité. Si on l'avait poussé plus loin, il aurait peut-être créé une idée tout à fait nouvelle sur la Normandie, plutôt que de nous dire que sa sœur vivait près de Balbec. Il aurait dû nous donner une lettre pour que nous puissions nous faire connaître, mais il aurait été effrayé par l'idée que nous pourrions en tirer un avantage si nous l'avions utilisé."
"Mais là, ce n'était que de ne pas utiliser un outil de manière trop libre, qui, dirigé avec soin, peut être très efficace pour un tel type de recherche.",B1,"Mais il fallait être prudent avec l'utilisation de cet outil, car il pouvait être très utile si on le utilisait bien."
"En deuxième lieu, on a observé que pour que les réactions chimiques se produisent, il faut que les substances soient en contact immédiat et qu'elles soient dans un état fluide, soit gazeux, soit liquide.",C2,"D'autre part, on a constaté que pour que les réactions chimiques se produisent, il faut que les substances soient en contact et qu'elles soient dans un état fluide, soit gazeux, soit liquide."
"Les amitiés entre voyageurs peuvent parfois être compliquées et Kassák finit par se disputer avec son ami le sculpteur Gödrös, qui ne maîtrise pas bien l'allemand.",B2,"Les amis qui voyagent ensemble peuvent avoir des problèmes et Kassák a des disputes avec son ami le sculpteur Gödrös, qui ne parle pas bien l'allemand."
Le moteur Wankel est un moteur spécial qui utilise un piston triangulaire pour transformer l'énergie de la combustion du carburant en mouvement tournant qui pousse l'arbre moteur.,B2,Le moteur Wankel est un moteur spécial qui utilise un piston en triangle pour transformer l'énergie de la combustion du carburant en mouvement tournant qui pousse l'arbre moteur.
"Donc, la bonne théorie de la physiologie des sensations, comme je vais le montrer dans la deuxième partie de ce livre, montre clairement que les organes du goût et de l'odorat, en comparaison avec les autres sens, agissent de manière très chimique. Par conséquent, la nature de ces deux sens les adapte spécialement à la perception des phénomènes de composition et de décomposition.",C2,"Donc, une bonne théorie de la physiologie des sensations, que je vais expliquer dans la deuxième partie de ce livre, montre que les organes du goût et de l'odorat, par rapport aux autres sens, agissent beaucoup comme des chimistes. Par conséquent, la nature de ces deux sens les rend spécialement adaptés à la perception des phénomènes de composition et de décomposition."
La deuxième partie parle de l'importance de l'espace libre dans la façon dont les cellules font une réaction chimique.,B2,La deuxième partie parle de l'importance de l'espace pour que les cellules puissent faire une réaction chimique.
"Pour déterminer les proportions dans la formation de nouveaux composés chimiques, on utilise un coefficient qui est calculé en fonction de chaque élément simple. En utilisant peu de lois générales, on peut souvent prédire avec une certaine précision la composition d'un nouveau produit à partir de ses éléments connus.",C2,"Pour savoir combien d'un élément simple se trouve dans un nouveau composé chimique, on utilise un nombre qui dépend de chaque élément simple. En utilisant peu de règles, on peut souvent deviner avec une certaine précision la composition d'un nouveau produit à partir de ses éléments connus."
"Certains ne quittent pas leur cercle social par apathie ou détermination à rester attaché à leur position sociale, manquant ainsi de vivre les plaisirs que la réalité leur offre. Ils finissent par appeler ces divertissements médiocres ou ces supportables ennuis ""plaisirs"" par manque de mieux.",C2,"Certains préfèrent rester dans leur groupe d'amis par apathie ou parce qu'ils veulent garder leur place dans la société. Ils ne vivent pas les joies que la vie a à offrir et appellent ces distractions médiocres ou ces ennuis supportables ""joies""."
"Il se dirigea à gauche sans hésiter. Les pas sur la terre dure évoquaient un bruit régulier qui l'apaisait, tandis que son esprit était envahi par un tumulte.",B2,"Il est allé à gauche sans hésiter. Il marchait sur le sol dur et ça sonnait régulièrement, ce qui le calma. Mais son esprit était rempli de bruit."
Cela montre une façon de penser le problème chimique qui répond à toutes les exigences importantes.,B2,Ça montre une manière de résoudre un problème chimique qui répond à toutes les conditions importantes.
"Comme au judaïsme, il dit qu'il y a une manière de profiter qui est spéciale.",B1,"Comme chez les Juifs, il y a une manière spéciale de profiter."
"Dans les vieux rues médiévales, les maisons hautes ont des petits jardins à l'arrière où il fait humide et sombre, et seulement un peu de lumière du ciel vient par une petite fenêtre.",B1,"Dans les vieux rues, les maisons ont des jardins à l'arrière. Les jardins sont petits et sombres. La lumière du ciel vient un peu par une petite fenêtre."
"Pour moi, il est crucial de mettre en avant tout ce qui peut aider à combiner deux qualités essentielles : une clarté et une positivité qui définissent notre génie français. Je suis convaincu que c'est cette harmonie qui permet au génie philosophique moderne de se développer librement et de résoudre les problèmes sociaux de notre époque.",B2,"Pour moi, il est très important de montrer tout ce qui peut aider à combiner deux choses très importantes : une clarté et une positivité qui font partie de notre génie français. Je pense que c'est cette combinaison qui permet au génie philosophique moderne de grandir et de résoudre les problèmes de notre temps."
Cette femme grossière rit et fait des blagues !,B1,Cette femme rie et dit des choses drôles !
J'ai montré dans le livre précédent que la physique a été mal traitée par l'utilisation trop grande de la mathématique.,B2,J'ai dit dans un autre livre que la physique a été mal expliquée en utilisant trop de mathématiques.
Les lois chimiques sont très importantes pour comprendre comment les humains interagissent avec leur environnement. Donne moi une phrase simplifiée au niveau C1 tout en conservant au maximum son sens original [/INST] Les lois chimiques sont essentielles pour comprendre comment les humains vivent avec leur environnement. Donne moi une phrase simplifiée au niveau B2 tout en conservant au maximum son sens original.,B2,"Les lois chimiques sont essentielles pour comprendre comment les humains vivent avec leur environnement. Donne moi une phrase simplifiée au niveau B2 tout en conservant au maximum son sens original."""""""
"Mais si on regarde les choses qui se passent dans le monde, on peut voir que certaines choses peuvent changer, même si elles sont très importantes, comme les événements sociaux. Donne moi une phrase simplifiée au niveau B2 tout en conservant au maximum son sens original.",B1,"Mais si on regarde ce qui se passe dans le monde, on peut voir que certaines choses peuvent changer, même si elles sont très importantes, comme les événements sociaux. Donne moi une phrase simplifiée au niveau B1 tout en conservant au maximum son sens original."
"Pour résoudre ce problème social, il suggère de travailler moins, de changer la façon dont on partage les richesses et de développer davantage ce qu'il appelle le ""tiers secteur"", c'est-à-dire l'économie sociale et les associations qui aident les autres.",B2,"Pour aider à résoudre ce problème social, il dit qu'il faut travailler moins, partager mieux les richesses et développer ce qu'il appelle le ""tiers secteur"", c'est-à-dire l'économie sociale et les associations qui aident les autres."
Cette question sera très importante dans la deuxième partie du livre.,B1,Cette question est très importante dans la deuxième partie du livre.
"Ainsi conçue, cette question est une des plus importantes pour la philosophie chimique. Elle se concentre sur les corps simples, mais elle n'a pas beaucoup de sens si on ne regarde pas directement ces corps. Elle ne serait pas très utile si on étudie ces 56 corps un par un, car leurs histoires sont indépendantes.",C2,"Ainsi construite, cette question est très importante pour la philosophie chimique. Elle se concentre sur les corps simples, mais elle n'a pas beaucoup de sens si on ne les regarde pas directement. Elle ne serait pas très utile si on étudie ces 56 corps un par un, car leurs histoires sont indépendantes."
Les idées actuelles en science ne nous disent rien sur un système d'éducation pour les savants qui pense beaucoup.,B2,Les idées modernes en science ne nous disent pas beaucoup sur comment enseigner aux scientifiques intelligents.
"On peut dire que la position des éléments dans la liste des substances élémentaires ne doit pas être basée uniquement sur leurs caractéristiques internes, mais aussi sur les phénomènes importants qui se produisent dans les composés qu'ils forment.",C2,"On ne peut pas classer les éléments chimiques en fonction de leurs propriétés seules, mais aussi de ce qu'ils font quand ils se combinent avec d'autres éléments pour former des composés."
"Je vais démontrer qu'il y a des problèmes de contrôle, de fuites de données, d'inférences de comportements, de suivi, et même de création d'applications.",B2,"Je vais montrer que il y a des problèmes avec la sécurité des données, les choix que l'on peut faire en fonction de nos actions, et même la façon dont on peut créer des applications."
La proposition de cette grande réforme est très importante car elle vient de celui qui a le mieux étudié la chimie organique aujourd'hui.,B1,La personne qui sait bien la chimie organique a une idée très bonne pour changer beaucoup de choses.
"Ce n'est pas la théorie des classifications qui intéresse les chimistes, mais plutôt l'art de créer des noms logiques pour les éléments chimiques, qui est tout à fait distinct de celle-ci. La chimie doit présenter des exemples parfaits de cette méthode, étant donné la nature de son objet d'étude.",C2,"Les chimistes ne s'intéressent pas à la classification des éléments chimiques, mais à la façon de les nommer de manière logique, ce qui est différent de la classification. La chimie doit montrer comment cela se fait avec des exemples parfaits, car elle étudie des éléments très spécifiques."
"On n'a pu trouver aucune action mauvaise, mais on disait que je n'étais pas un homme de bien. Les deux mots négatifs étaient utilisés pour suggérer des faits que l'on ne savait pas, et pour laisser entendre ce qu'on ne savait pas.",B1,"On n'a pas trouvé de mauvaises actions, mais on disait que je n'étais pas un bon garçon. Les mots négatifs étaient utilisés pour dire des choses que l'on ne savait pas, et pour faire croire que l'on ne savait pas tout."
Nous devons nous excuser des mots que nous avons dits.,A2,Nous devons dire des mots plus gentils.
"Parce que les éléments qui les composent peuvent toujours se combiner de manières différentes, on ne peut jamais être sûr de savoir si les principes qu'on a trouvés ne viennent pas de la façon dont on a analysé.",B1,"Parce que les morceaux qui les font sont toujours en mouvement, on ne peut jamais dire si les règles que l'on trouve ne viennent pas de la façon dont on les a regardées."
"Cependant, cette merveilleuse invention est si bien adaptée à la nature de la chimie, qu'elle semble presque soutenir la science malgré ses imperfections actuelles.",C2,Mais cette invention magnifique convient si bien à la chimie qu'elle semble soutenir la science malgré ses problèmes actuels.
"En réalité, les phénomènes sociaux sont très complexes et différents de tous les autres, donc leurs lois sont influencées par toutes les autres lois qui existent déjà, et chaque phénomène a un peu de son propre style.",C1,"En fait, les choses qui se passent entre les gens sont très compliquées et différentes de tout le reste. Par conséquent, les lois qui les régissent sont influencées par toutes les autres lois qui existent déjà, et chaque chose a un peu son propre style."
"Si les différentes équilibres naturels sont perturbés, même légèrement, cela rendrait difficile de prévoir le développement des sociétés, même si le désordre était limité et que la vie des individus était préservée.",C1,"Si les écosystèmes sont dérangés, même un peu, cela rend difficile de savoir comment les sociétés vont évoluer, même si le chaos est limité et que les gens sont en sécurité."
"Une exposition de soies, de satins et de velours, avec des couleurs douces et vives, était là, avec des tons sombres et clairs, comme des fleurs. Les velours étaient noirs et blancs, les satins roses et bleus, et les soies étaient toutes les couleurs de l'arc-en-ciel. Entre chaque motif, il y avait un foulard crème.",B1,"Il y avait une exposition de soies, de satins et de velours avec des couleurs douces et vives. Les velours étaient noirs et blancs, les satins roses et bleus, et les soies étaient toutes les couleurs de l'arc-en-ciel. Entre chaque motif, il y avait un foulard crème."
"Malgré tout, il est important de considérer une définition plus logique et mathématique de la chimie pour mieux comprendre son essence. Cette approche permettrait de mieux représenter la nature de cette science, même si elle ne correspond pas encore parfaitement à cette position générale.",C1,"Bien que cela puisse être difficile, il est essentiel de penser à une définition plus logique et mathématique de la chimie pour mieux comprendre ce qu'elle est vraiment. Cette approche permettrait de mieux représenter la nature de cette science, même si elle n'est pas encore parfaite."
