Sentence,Difficulty,Simplified
"La grande complexité de la chimie est probablement due à sa nature plus complexe et à son développement récent. Il est presque impossible de croire qu'elle pourrait jamais atteindre un état aussi logique que les sciences qui étudient des phénomènes plus simples, comme l'astronomie, qui est le modèle idéal de la philosophie naturelle.",C2,"La chimie est très complexe parce qu'elle étudie des phénomènes très complexes et qu'elle est encore en développement. Il est difficile de croire qu'elle pourrait jamais être aussi logique que l'astronomie, qui est un exemple parfait de la philosophie naturelle."
"Si on ne pouvait plus les réassembler pour retrouver l'état original, il n'y aurait aucun doute sur la validité de la solution, sauf si on avait des raisons solides de douter de la vraie simplicté d'un des éléments analysés.",C1,"Si on ne pouvait plus les réassembler, on serait sûr que la solution est bonne, sauf si on avait des raisons de douter d'un des éléments analysés."
"Donc, selon cette obligation, le niveau de développement donné à l'examen philosophique de chaque science fondamentale dans cet ouvrage ne peut pas uniquement être déterminé par sa propre importance ou par le nombre de faits intéressants qu'elle englobe. Il dépend aussi beaucoup de sa perfection par rapport aux autres sciences.",C2,"Par conséquent, cette obligation signifie que la manière dont chaque science fondamentale est examinée dans ce livre ne peut pas seulement être décidée par sa importance ou par le nombre de faits intéressants qu'elle contient. Elle dépend aussi beaucoup de sa qualité par rapport aux autres sciences."
"Les idées que l'on pense être les réponses à un problème sont souvent des versions simplifiées des explications philosophiques, qui tentent de décrire un phénomène complexe à l'aide de mots généraux.",C2,Les idées que l'on a sur un problème sont souvent des versions simplifiées des idées philosophiques plus complexes.
"Pour comprendre l'histoire ancienne, il faut regarder autour de la Méditerranée. Cette région était importante à cette époque, mais elle n'a pas de sens si on regarde plus loin.",B1,"Pour savoir comment il était avant, on regarde près de la mer Méditerranée. Il y avait beaucoup d'importance là-bas, mais ça ne dit pas tout si on regarde plus loin."
"Malgré tout, il est clair que les réactions chimiques sont différentes des phénomènes physiques et qu'elles ont toujours quelque chose de spécial, comme le dit Bergmann avec force.",B2,"Bien que cela puisse sembler compliqué, on sait que les réactions chimiques sont différentes des choses qui se passent dans la nature et qu'elles ont toujours quelque chose de spécial, comme le dit Bergmann."
"La vraie science consiste à établir des relations précises entre les faits observés pour déduire les phénomènes secondaires à partir de peu de phénomènes fondamentaux, sans chercher les causes et les essences.",C2,"La vraie science est de trouver des liens entre les choses que l'on voit pour comprendre ce qui se passe et pourquoi, en utilisant peu de choses de base."
Elle avait accepté son mari sans vraiment aimer ça.,B1,"Elle a dit oui à son mari, mais elle n'aimait pas vraiment ça."
"Après avoir analysé en détail toutes les parties de ce discours, je peux maintenant voir clairement les idées fondamentales de la philosophie chimique. Enfin, je vais les résumer rapidement sous son aspect final, qui concerne le principe de division rationnelle important pour la science chimique.",C2,"Après avoir étudié en profondeur chaque partie du discours, je peux maintenant voir clairement les idées principales de la philosophie chimique. Ensuite, je vais les résumer brièvement sous sa forme finale, qui concerne l'importance du principe de division rationnelle pour la science chimique."
"Si un objet a été pris appart, il faut le considérer comme capable de se reformer, bien que cela puisse être difficile ou presque impossible à faire.",B1,"Si quelque chose est cassé, on peut le réparer, mais ça peut être difficile ou presque impossible."
"Au contraire, les régions tempérées lointaines ne sont pas très intéressantes pour les colonisateurs avant que l'Europe ne se multiplie beaucoup au 19ème siècle, moment où ces nouveaux pays deviennent comme des parties de l'Europe.",B2,"En fait, les régions froides loin d'ici ne sont pas très intéressantes pour les gens qui vont loin de chez eux avant que l'Europe ne soit très peuplée au 19ème siècle, et alors ces nouveaux endroits sont comme des parties de l'Europe."
"Selon Dzinkowski en 2000, beaucoup de chercheurs pensent que jusqu'à 90% de la valeur des entreprises vient de leur utilisation de leurs idées et inventions (Dzinkowski, 2000).",C1,"Selon Dzinkowski en 2000, beaucoup de chercheurs pensent que la valeur des entreprises vient principalement de leurs idées et inventions (Dzinkowski, 2000)."
"Penser à ce qui n'existe pas, à l'absolu, c'est ce que la philosophie doit faire avant tout.",B1,"Pensé à ce qui n'est pas réel, à ce qui est très grand, c'est ce que la philosophie doit faire."
"Certains philosophes modernes qui avaient une approche plus positive de la nature ont utilisé l'histoire naturelle pour critiquer l'idée que la plupart des éléments chimiques sont simples. Parmi eux, Cuvier est le plus célèbre. Cette objection est assez précise, mais pas suffisante.",C2,"Certains philosophes modernes qui aiment la nature ont utilisé l'histoire de la nature pour critiquer l'idée que les éléments chimiques sont simples. Cuvier est le plus connu. Cette objection est assez précise, mais pas suffisante."
"Dès que j'ai mangé, j'ai ressenti un calme.",B1,"Dès que j'ai mangé, j'ai ressenti un calme."
"En comparant ces phénomènes aux événements astronomiques, j'ai montré dans le livre précédent qu'ils sont moins généraux, car ils ne se produisent pas dans toutes les situations, car ils dépendent toujours de certaines conditions.",C2,"En comparant ces phénomènes aux événements astronomiques, j'ai montré dans le livre précédent qu'ils sont moins généraux, car ils ne se produisent pas dans toutes les situations, car ils dépendent toujours de certaines conditions."
"La géologie actuelle, malgré son manque d'informations, nous montre que nous devons faire face à une situation similaire dans le futur, et peut-être bientôt. Les philosophes de l'âge théologique devaient peut-être en avoir une idée grâce à un instinct vague, alors qu'ils cherchaient à relier l'astrologie et l'alchimie.",B2,"Les scientifiques d'aujourd'hui disent que notre planète pourrait avoir des problèmes de géologie dans l'avenir, et cela pourrait arriver bientôt. Les gens qui étudiaient la nature il y a longtemps, avant la science, pourraient avoir eu une idée de cela, mais ils ne savaient pas vraiment comment expliquer ça avec l'astrologie et l'alchimie."
"Après avoir réfléchi à la philosophie de la chimie, on peut voir comment elle se situe dans l'ensemble des sciences et comment elle est explorée. Cela nous aide à comprendre où elle se place dans la hiérarchie des sciences et comment elle est étudiée.",B2,"Après avoir pensé à ce que dit la chimie, on peut voir où elle se place par rapport aux autres sciences et comment elle est étudiée. Cela nous aide à comprendre où elle se situe dans les sciences et comment on la fait."
Je ne pouvais pas me détendre et apprendre en même temps.,B1,Je ne pouvais pas relaxer et apprendre en même temps.
Il est important de ne pas craindre de dire que certains travaux scientifiques ne sont pas aussi bien organisés et logiques qu'ils devraient l'être en raison de manquements courants à une condition essentielle.,B2,"Il est important de ne pas être timide pour dire que certains travaux scientifiques ne sont pas aussi bien organisés et logiques qu'ils devraient l'être, parce que des erreurs courantes se produisent."
"Il est évident que, en examinant cette idée de similitudes de près, on ne peut pas manquer de voir que cette théorie n'est en réalité qu'une tentative, qui échoue, de comprendre la nature des réactions chimiques, aussi profonde que les essences qu'on cherchait autrefois pour les phénomènes plus simples.",C2,"Il est clair que quand on regarde cette idée de ressemblances de près, on ne peut pas manquer de voir que cette théorie n'est en réalité qu'une tentative, qui échoue, de comprendre la nature des réactions chimiques, aussi profonde que les essences qu'on cherchait autrefois pour les phénomènes plus simples."
"Finalement, il y a aussi du scepticisme, on parle de stoïcisme et on dit que penser que quelque chose est vrai dépend de qui le pense.",B2,"Finalement, il y a aussi des gens qui doutent, ils parlent de stoïcisme et disent que penser qu'une chose est vraie dépend de qui la pense."
"Il y a plusieurs idées importantes à aborder dans mon discours sur la chimie, comme comment elle cherche à comprendre le monde, où elle se situe par rapport aux autres sciences, si elle est parfaite, comment elle pense et comment elle est organisée.",B2,"Il y a beaucoup de choses à parler dans mon discours sur la chimie, comme comment elle étudie le monde, où elle se situe par rapport aux autres sciences, si elle est parfaite, comment elle pense et comment elle est organisée."
"Note : (retour) Les Français, avec leur génie national, sont très résistants aux idées étrangères, même si elles ont des points forts et des défauts.",B2,"Les Français sont souvent attachés à leurs traditions et à leur culture, même si d'autres pays ont des idées intéressantes."
Une contrainte est quelque chose qui vient de l'extérieur et qui n'est pas choisie par une personne.,B1,Un problème est quelque chose qui vient de l'extérieur et que tu ne peux pas choisir.
Il serait inutile de répéter que la chimie scientifique ne peut être comprise sans avoir d'abord appris la physique en profondeur.,C1,Dire que la chimie scientifique est difficile à comprendre sans avoir bien étudié la physique avant.
"Dans les sciences où il y a beaucoup de sujets à étudier, la chimie est unique car elle a des phénomènes simple et réguliers, ce qui permet de classer tout ce qu'on apprend de manière claire, rapide et complète, ce qui aide beaucoup à avancer dans la science.",B2,La chimie est un sujet de science qui est facile à comprendre parce qu'elle a des règles simples et qu'elle aide beaucoup à apprendre rapidement et bien.
"Selon cette approche philosophique, la physique elle-même, en raison de sa moindre perfection nécessaire, ne peut jamais avoir pour les chimistes autant d'utilité que l'astronomie, malgré ses relations bien plus étroites et plus étendues.",C2,"Selon cette philosophie, la physique n'est pas aussi utile pour les chimistes que l'astronomie, même si elle est plus étroitement liée à elle."
"La série qui en découle semble jusqu'à présent devoir être conforme à toutes les propriétés connues, soit des éléments eux-mêmes, soit de leurs principaux composés.",C2,"La suite de cette série semble suivre toutes les règles connues, soit pour les éléments eux-mêmes, soit pour leurs principaux composés."
"Enfin, il est important de constater la réalité de départ, c'est-à-dire de vérifier si les différents éléments sont effectivement organisés de manière constante, quelle que soit la situation extérieure ou l'état dans lequel ils se trouvent. Malheureusement, cette vérification n'a pas encore été effectuée de manière approfondie, et il se peut que les résultats ne soient pas conformes à l'idée initiale.",B2,"En fin de compte, il est essentiel de regarder la situation réelle, c'est-à-dire de vérifier si tout est bien organisé, quoi qu'il en soit. Malheureusement, on n'a pas encore vérifié bien tout ça, et on ne sait pas si ça correspond à ce qu'on pensait."
"Il est essentiel, selon l'argument précédent, de se concentrer sur la première comparaison ici.",B2,"Il est très important, selon ce que l'on a dit avant, de se focaliser sur la première comparaison ici."
"Malheureusement, l'extension de la chimie aujourd'hui a plus développé l'analyse que la synthèse, donc ces deux domaines sont loin d'être en équilibre.",B2,"Tragiquement, la chimie aujourd'hui se concentre plus sur l'analyse que sur la synthèse, donc ces deux domaines ne sont pas équilibrés."
"La grande diversité des substances organiques, qui sont complexes malgré leur faible nombre d'éléments, pourrait faire croire que simplifier leur théorie chimique ne donnerait pas aussi beaucoup d'avantages pour comprendre mieux la chimie.",C1,"Il y a beaucoup de différents types de substances organiques, même si elles ne contiennent que peu d'éléments, ce qui pourrait faire penser que simplifier leur théorie chimique ne donnerait pas beaucoup d'avantages pour mieux comprendre la chimie."
"Le marquis détestait vivement les idées, il disait que c'est elles qui ont perdu l'Italie. Il ne savait pas comment concilier cette haine de l'éducation avec le souhait de voir son fils Fabrice continuer à apprendre chez les jésuites.",B2,"Le marquis n'aimait pas les idées, il disait qu'elles avaient perdu l'Italie. Il ne savait pas comment vouloir que son fils Fabrice continue d'apprendre chez les jésuites avec ça."
"Quelle que soit l'idée que l'on a sur la façon dont notre planète a été créée, il est probable, à mon avis, de penser que les différents éléments sont répartis de manière presque uniforme sur la Terre, même si cela n'est pas tout à fait démontré.",B1,"Quelle que soit l'idée que l'on a sur la création de la Terre, il est probable que tout est partout sur elle, même si on ne peut pas le prouver tout à fait."
M. Ampère a été le premier à montrer l'importance de cette recherche et c'est le principal avantage de son excellent livre sur ce sujet.,B1,M. Ampère a été le premier à dire que cette recherche est importante et son livre est très bon pour apprendre ça.
"Quand elle me voit, elle se tait tout de suite, elle ne dit rien.",B1,"Quand elle me voit, elle se tait tout de suite."
